{
  "version": 1,
  "id": "guo-vps",
  "name": "GUO",
  "server": {
    "source": {
      "kind": "git",
      "url": "https://github.com/modernuo/ModernUO.git",
      "ref": "d4531cd94b739613155225c234900de9f47d2c88"
    },
    "patches": [
      "tools/modernuo/patches/0001-headless-owner-account.patch",
      "tools/modernuo/patches/0002-settable-update-range.patch",
      "tools/modernuo/patches/0003-felucca-spring.patch",
      "tools/modernuo/patches/0004-guo-pad-dummies.patch",
      "tools/modernuo/patches/0005-guo-pad-attack-record.patch",
      "tools/modernuo/patches/0005-system-message-hook.patch"
    ]
  },
  "config_overlay": "tools/modernuo/config-vps",
  "listen": {
    "port": 2593
  },
  "service": {
    "memory_max": "4G"
  },
  "backup": {
    "keep": 14,
    "on_calendar": "*-*-* 04:00:00"
  },
  "seed": "seed"
}
